,Date,User,Tweet
103,2022-02-19 01:18:42+00:00,bgarlinghouse,"The truth is out for everyone to read. What we see is that the SEC waited 8 years to decide they disagreed with this analysis, decimating thousands and thousands of XRP holders (who they purport to protect) in the process. So much for being mission-driven…"
104,2022-02-08 21:00:03+00:00,bgarlinghouse,"To see a statement like this is incredible (and reaffirming to so many in the space using crypto for good), after years of FUD that crypto is only for criminals."
105,2022-01-26 17:53:11+00:00,bgarlinghouse,you gotta wonder who decided to give this guy the mic??! Jk see you there Mike 😂
106,2022-01-26 00:40:32+00:00,bgarlinghouse,"RippleX - full speed ahead on establishing a multitude of capabilities to the XRP Ledger - NFTs, CBDCs, interoperability bridges, sidechains and so much more – working hand in hand with devs and partners around the world. It’s a multichain world after all 😁 4/4"
107,2022-01-26 00:40:32+00:00,bgarlinghouse,"RippleNet is much more than cross-border payments – it’s bringing crypto-native services such as liquidity to enterprises. Today, the network has a volume run rate &gt;$10B. Huge props to the team for continuously upping their game &amp; leaning into new capabilities every year. 3/4"
108,2022-01-26 00:40:32+00:00,bgarlinghouse,"2022 – “slow down” is not in our vocabulary. Even with 2021’s headwinds, it was our best year on record, and Ripple’s financial position ($1B in the bank) is the strongest we’ve ever been. 2/4"
109,2022-01-26 00:40:32+00:00,bgarlinghouse,Excited to announce @Ripple bought back our Series C (Dec 2019) shares at a $15B valuation! 1/4
110,2022-01-20 02:14:17+00:00,bgarlinghouse,"My semiannual PSA - noticed an uptick lately in XRP giveaways falsely claiming to be from Ripple and/or me. These are 100% fake and trying to steal your crypto. 

Thanks to all reporting the scams / stay vigilant!"
111,2022-01-11 16:25:09+00:00,bgarlinghouse,"🚨 new year, new #XRPL capabilities!"
112,2021-12-24 18:02:07+00:00,bgarlinghouse,"Ok, I also wrote down some thoughts on Jay Clayton’s about-face op-ed in @WSJOpinion in comparison with his actions in office. https://t.co/LfSODCIzuQ https://t.co/uWd1c3uAsV"
113,2021-12-22 18:49:16+00:00,bgarlinghouse,This holiday season – let’s make the time to reach out to our elected officials in Congress so they understand the need to act now. I hope the industry gets some answers instead of another lump of coal. 10/10
114,2021-12-22 18:49:16+00:00,bgarlinghouse,"Ironically enough, and a personal favorite of mine of the brilliance of @Joelkatz, this is what he predicted could happen almost 2 years before the SEC filed their lawsuit. #nostradamus 9/10 https://t.co/cA4hstW2Wf"
115,2021-12-22 18:49:15+00:00,bgarlinghouse,Calling crypto the “Wild West” is a farce – most are complying with financial regulators globally. This industry shouldn’t be punished for asking for regulatory clarity &amp; regulation that is consistently applied with a level playing field. 8/10
116,2021-12-22 18:49:15+00:00,bgarlinghouse,"Ignoring its prior statements, the SEC today won’t answer questions about the legal status of ETH, much less anything else. Is the agency actually living up to its mission of protecting investors w/ regulation by enforcement &amp; what @HesterPeirce calls ""strategic ambiguity""?  7/10"
117,2021-12-22 18:49:14+00:00,bgarlinghouse,"Which brings me back to the SEC. As Chair @GaryGensler seeks to expand its remit, he has taken an aggressively anti-crypto approach and companies are already moving outside the US. Web2 was built with many American companies, but Web3 (or whatever we want to call it)?

TBD! 6/10"
118,2021-12-22 18:49:14+00:00,bgarlinghouse,"Not to mention new ODL corridors like Japan and UAE, and our CBDC solution built on a private version of the public XRPL partnering with Bhutan and Palau! All of this growth came from outside the US for (sigh) obvious reasons… 5/10"
119,2021-12-22 18:49:14+00:00,bgarlinghouse,"Proud to say it was @Ripple’s strongest year ever (XRP-based On-Demand Liquidity payments account for 25% of $ volume across RippleNet, and ODL txns are up 25x from Q3 2020, and 130% QoQ). 4/10 https://t.co/2V2ORfzTqm"
120,2021-12-22 18:49:13+00:00,bgarlinghouse,"2021 has been a watershed year for crypto. Acceptance and awareness of the opportunity to bring billions of people into the global financial community has never been so clear. It’s been incredible to see a lot less ‘maximalism’, and many more builders joining the industry. 3/10"
121,2021-12-22 18:49:13+00:00,bgarlinghouse,"Of all the shitty things in 2020, this was certainly one to cap the year 🤣. But what I said then remains (painfully) true today: this is an attack on crypto in the US, not just Ripple. Some took the SEC’s allegations at face value/ thought this was a one off, but no longer. 2/10"
122,2021-12-22 18:49:12+00:00,bgarlinghouse,"One year ago today, the @SECgov filed a lawsuit against @Ripple, @chrislarsenSF and me, alleging that XRP – a public crypto that has been trading on the open market since 2013 – should have been registered as a security. 1/10"
123,2021-12-16 23:27:30+00:00,bgarlinghouse,"Siri, play “Ironic” by Alanis Morissette…

https://t.co/idRTZmDSbL"
124,2021-12-06 17:34:42+00:00,bgarlinghouse,"Asking for myself (oh, and a friend)"
125,2021-11-25 16:47:28+00:00,bgarlinghouse,"Thankful to be part of Team @Ripple and thankful for the entire XRP community - today, and everyday!"
126,2021-11-24 17:39:44+00:00,bgarlinghouse,Out with the old (rails) and in with the new
127,2021-11-23 18:33:09+00:00,bgarlinghouse,"My personal views on dogecoin aside ;) I think there will be many winners in this industry. I’m bullish on overall crypto momentum for 2022  w/ regulatory clarity and progress in the UK, Singapore, UAE, Japan and others. 2/2 https://t.co/D42UX3dm4m"
128,2021-11-23 18:33:08+00:00,bgarlinghouse,"Great to catch up with you @dan_murphy at #FTAD! Despite (regulatory) headwinds in the US, @Ripple has had a blockbuster year with ODL expansion &amp; MENA traction, and we are gearing up to hire a few hundred people next year to fuel our growth. 1/2"
129,2021-11-16 14:51:41+00:00,bgarlinghouse,The crypto industry is stepping up to the plate for public-private collaboration on policy – no question about it – and we will continue to seek to work together on the optimal path forward. 2/2
130,2021-11-16 14:51:40+00:00,bgarlinghouse,Our proposed policy framework is a three-pronged approach of what can be done now to provide clarity to one of the fastest-growing industries in the U.S. It’s also the result of our direct interactions with regulators and bipartisan policymakers. 1/2
131,2021-11-09 15:01:15+00:00,bgarlinghouse,"Today, we announced a new product at #RippleSwell -- Liquidity Hub! Any enterprise that wants to offer crypto to their customers? You can source tokenized assets from Ripple via Liquidity Hub - soon to come next year.  https://t.co/Hbhr0hemh3"
132,2021-11-09 13:51:24+00:00,bgarlinghouse,"Coming to you from #RippleSwell -- 2 incredible days of fireside chats, panels and presentations starting at 9 am ET from @elerianm, @SBF_FTX, @Tranglo, @Azimo, @Coinme, the Royal Monetary Authority of Bhutan and many more! https://t.co/wCMUxbhb0v"
133,2021-11-02 20:49:30+00:00,bgarlinghouse,"@ChrisBrummerDr is right -- there is a lot at stake here, which is why we need Congress to play a leading role in providing guidance and clarity for not just stablecoins as is recommended by the PWG report, but crypto broadly ASAP."
134,2021-10-30 17:21:10+00:00,bgarlinghouse,I’m floored by what team @Ripple achieved in Q3. Here are some of my favorite stats ⤵️
135,2021-10-06 22:13:45+00:00,bgarlinghouse,I think this article’s subheadline says it all 👀
136,2021-10-05 23:27:34+00:00,bgarlinghouse,"Despite a unique set of challenges this year, each quarter has topped the one before! Incredibly proud of team @Ripple for forging ahead and getting it done. Congrats to Team Ripple!"
137,2021-10-04 18:33:08+00:00,bgarlinghouse,Today was another good day.
138,2021-09-29 14:39:26+00:00,bgarlinghouse,"Calling all creators, developers and brands -- @Ripple is launching a $250M Creator Fund!"
139,2021-09-25 20:07:43+00:00,bgarlinghouse,"Instead of working with the industry, the SEC is using their meetings with companies as lead generation for their enforcement actions. Once the dust settles, it’ll be clear that Ripple’s on the right side of the law, and the right side of history. 2/2"
140,2021-09-17 15:16:29+00:00,bgarlinghouse,@LeoHadjiloizou @digitalassetbuy @attorneyjeremy1 @JohnEDeaton1 @CGasparino i love twitter
141,2021-09-14 19:45:42+00:00,bgarlinghouse,"Chair Gensler insisted (again) in today's testimony that the securities laws are clear and easily understandable for the crypto market...and then turned around and said Congress needs to write laws to clarify. So which one is it?

Thank you @SenToomey for being a voice of reason."
142,2021-09-08 20:47:54+00:00,bgarlinghouse,"If you want to go fast, go alone. If you want to go far, go together. 3/3"
143,2021-09-08 20:47:54+00:00,bgarlinghouse,"Thankfully today many recognize the havoc caused by regulation by enforcement. We’re ready to work with responsible actors, pro-innovation members of Congress, and others in paving a path to clarity and certainty with US regulators. 2/3"
144,2021-09-08 20:47:53+00:00,bgarlinghouse,"The SEC’s continued warfare on crypto continues to play out. In Dec 2020, I said that we’d been having discussions with the SEC for nearly 3 years about XRP, “..and yet never been met with clarity.” Sound familiar!? 1/2 

https://t.co/wGHW4hCW2T"
145,2021-09-08 04:34:13+00:00,bgarlinghouse,https://t.co/SO5QDqdrMY
146,2021-09-04 00:16:07+00:00,bgarlinghouse,"This paper has nearly been a year in the works -- thrilled to see it go live. Over the draft process, I was reminded of how much we in crypto have in common, especially the shared vision that crypto has so much positive potential. Good to reflect on that every once in a while :)"
147,2021-08-31 17:55:19+00:00,bgarlinghouse,At least one learning I’ll take from this experience: never bet against the tenacity and thoroughness of Twitter sleuths! 2/2
148,2021-08-31 17:55:19+00:00,bgarlinghouse,"This. ⬇️ 

This has been clear from the start -- the SEC’s lawsuit isn’t just about Ripple, it’s about what “...impossible standards of fair notice and due process” through regulation by enforcement can do to crypto innovation. “Anyone could be next without warning.” 1/2"
149,2021-08-17 15:34:58+00:00,bgarlinghouse,"Good morning to everyone who has already voted for @Ripple’s @MonicaLongSF and @FortePlatform’s SXSW session: “Beyond the NFT Hype: Unlocking Token Economies” ;) 

Voting closes Aug 27! https://t.co/hlmR8X1xrK"
150,2021-08-04 09:03:42+00:00,bgarlinghouse,"In 2018 Bill Hinman said ETH isn’t a security and Jay Clayton agreed. But just weeks ago, Hinman filed a sworn affidavit in Court saying the SEC still has “not taken any position or expressed a view” on ETH’s status…so how is the market supposed to have clarity?!"
151,2021-08-02 18:45:24+00:00,bgarlinghouse,"Looking forward to discussing crypto’s momentum on Wednesday at the @AspenSecurity Forum. With clear frameworks and clear regulation, I have no doubt that this industry will flourish here in the US and globally. 

Register here: https://t.co/6207hLgCs5"
152,2021-07-28 13:08:02+00:00,bgarlinghouse,"Hugely excited about our newest ODL corridor -- Japan is one of our largest markets. With regulatory clarity and innovative partners like SBI, the region is ready for a crypto-enabled future"
153,2021-07-27 23:29:50+00:00,bgarlinghouse,"As @senwarren has recognized, our current banking and payment systems need improvement. Crypto and blockchain were originally created to provide access to those who have consistently been left out - and many companies are using this tech for precisely that purpose! 4/4"
154,2021-07-27 23:29:49+00:00,bgarlinghouse,"Like any technology or currency, crypto &amp; blockchain can be used for good or bad. To discount the real use cases for billions globally (cross-border/micro payments, tokenization, instant settlement, transparency to name a few) because of the actions of a few is shortsighted. 3/4"
155,2021-07-27 23:29:48+00:00,bgarlinghouse,"I’m also encouraged by bipartisan efforts to provide much-needed regulatory frameworks to an industry that is by and large looking to work with policymakers, not against them. As i have said before, all blockchains and cryptos should not be painted with a single broad brush. 2/4"
156,2021-07-27 23:29:46+00:00,bgarlinghouse,I’m encouraged by this morning’s Senate Banking hearing that members of Congress are looking to understand the nuances within crypto - a far cry from just a few years ago when some thought crypto is just a fad or mostly for criminals. 1/4
157,2021-07-19 19:30:01+00:00,bgarlinghouse,Congrats to our fantastic CFO @k_stanier_c! Also welcome to Twitter 🤣
158,2021-07-13 22:36:51+00:00,bgarlinghouse,"Had our quarterly all hands today -- feeling inspired by the team and proud of @Ripple’s momentum as we head into H2. Hundreds of Ripplers dialed in globally, and some were even able to join in person via our SF, London and Iceland offices for the first time since 2020! https://t.co/iP9bnS5vzU"
159,2021-07-09 22:33:12+00:00,bgarlinghouse,Very cool to see how far NFT tech has come already (especially in comparison to my comic book collection growing up 😂)
160,2021-07-07 20:04:05+00:00,bgarlinghouse,".@ashgoblue lays out our vision for RippleNet to serve enterprises in an increasingly tokenized world. We’re building the future of crypto-enabled financial services, one block at a time."
161,2021-06-13 04:02:29+00:00,bgarlinghouse,@DanRose999 I remember it well!
162,2021-06-10 17:06:34+00:00,bgarlinghouse,Congrats to Mike and team!
163,2021-06-07 17:12:34+00:00,bgarlinghouse,"My favorite quote from the article: 

“We must also keep in mind the default rule in the American system: Innovation is welcome absent some legal reason to oppose it.” 

Words to live by! 3/3"
164,2021-06-07 17:12:34+00:00,bgarlinghouse,"Cryptos, like nearly any new innovative technology, can be used for good or bad purposes. The problem is that US companies seeking to be compliant and use this tech for good are left in limbo (or for Ripple, worse!) because of a lack of a clear, predictable framework. 2/3"
165,2021-06-07 17:12:33+00:00,bgarlinghouse,"My main takeaway from this? Jay Clayton is joining the chorus of voices saying there is &amp; has been a lack of regulatory clarity for crypto and that stifles innovation here in the US (definitely ironic, but better late than never!) 1/3"
166,2021-06-01 16:07:07+00:00,bgarlinghouse,@BankXRP @Ripple @CNBC I'm doing my happy dance today
167,2021-05-26 20:06:29+00:00,bgarlinghouse,"Thanks @JoeSquawk and @andrewrsorkin for having me on to chat about Ripple’s traction, the differences between Ripple and XRP, and the need for regulatory clarity. On the second point...fixed your graphic for you 😉 2/2 https://t.co/5xqFgXGKmi"
168,2021-05-24 16:06:49+00:00,bgarlinghouse,@ThinkingCrypto1 @Okcoin congrats Tony!
169,2021-05-24 04:42:42+00:00,bgarlinghouse,"@Melt_Dem It’s beyond flattering that you think Ripple is the puppetmaster behind Elon Musk, countless scientists, governments, crypto enthusiasts and others who have stated the facts about BTC’s energy use…. 🤣

https://t.co/csb7bBIGxq"
170,2021-05-12 23:21:18+00:00,bgarlinghouse,"Let’s not overthink this..few people have changed the world the way @ElonMusk has. No doubt that BTC is here to stay - but denying there is a problem isn’t a path to solving it. Whether it’s through renewables or architectural changes, let’s keep moving on the solution."
171,2021-05-04 15:32:22+00:00,bgarlinghouse,"Thrilled to add two exceptional leaders to the team. As Ripple continues to grow, @RosieRios and Kristina bring deep financial and regulatory expertise that will be invaluable. Welcome to Ripple!"
172,2021-04-28 00:29:21+00:00,bgarlinghouse,"~10 yrs later, the US still lacks a clear regulatory framework for crypto. Assets like XRP are open-source + global by nature, &amp; hundreds of projects are building w/ XRPL. Innovation can’t be stopped, it may just thrive out of the US. Thanks @LizClaman for the chat!"
173,2021-04-21 22:03:03+00:00,bgarlinghouse,"@arrington Something like 15 years ago, thanks to @hollarsk"
174,2021-04-21 21:01:31+00:00,bgarlinghouse,"Great chatting with you, Tony! Fun to discuss everything from where the SEC’s lawsuit stands and how Ripple is utilizing XRP today, to how I met @arrington and my ice cream addiction. Never a dull moment in crypto...thanks for having me!"
175,2021-04-16 19:53:50+00:00,bgarlinghouse,@YIAU1234 @CryptoLawUS @Ripple Can I get a vote on who plays me?!
176,2021-04-11 15:07:51+00:00,bgarlinghouse,@EaderSherry this is a scam
177,2021-04-11 15:07:21+00:00,bgarlinghouse,@EaderSherry no
178,2021-04-08 16:28:58+00:00,bgarlinghouse,"Making crypto run on 100% renewables is a big hairy audacious goal, but it can be done. 

Congrats to @CryptoClimAcc on today’s launch! https://t.co/9ad6ZRbano"
179,2021-04-06 23:55:26+00:00,bgarlinghouse,Today was a good day.
180,2021-04-05 02:17:00+00:00,bgarlinghouse,"We have the tools to make crypto 100% renewable AND reach its full potential. Let’s focus on the solutions to change the opinion of Janet Yellen, Bill Gates, and countless others who have pointed out concerns about energy usage instead of accusing me of FUD… 4/4"
181,2021-04-05 02:17:00+00:00,bgarlinghouse,"Using 0.49 Megatonne CO2 /TWh (Stoll’s estimate - weighted avg carbon intensity is 0.48 - 0.5 CO2 Mt /TWh) --&gt; 0.000000588 Mt CO2/txn. EPA shows 112523894 gallons of gas produces 1 Mt CO2, so ~70 gallons of gas is emitted from 0.000000588 Mt of CO2. 3/4 https://t.co/jE2mNY29KG"
182,2021-04-05 02:17:00+00:00,bgarlinghouse,"Citing the figures I used to get to this stat: Cambridge BTC Index’s avg March data (132.07 Terrawatt hour annualized) / 365 = 0.362 TWh (daily avg energy). With March’s avg number of txns/day (301,359), you get 0.000001201 TWh (avg energy/txn). 2/4 https://t.co/8bD6YeCHCC"
183,2021-04-05 02:17:00+00:00,bgarlinghouse,"Guess I touched a nerve! My comment was about how many gallons of gas emit the same amount of CO2 as a BTC txn (could’ve been more clear in the clip). First off, I’m DEFINITELY not saying ban BTC! I’m saying we, collectively, can and should understand PoW’s carbon footprint. 1/4"
184,2021-04-01 22:55:30+00:00,bgarlinghouse,"Thanks @jchatterleyCNN for having me on the show. Still amazing to think that when we first talked, crypto was around a $200B market cap...here we are at $2T! (🚀?)"
185,2021-04-01 15:09:11+00:00,bgarlinghouse,@j_crypto_2015 @XRPcryptowolf The problem is that not everyone has a PayPal account...it's still a closed network. Enabling a highly scalable and highly efficient solution for interoperability across and between networks is a critical piece that is missing in our financial system.
186,2021-04-01 13:52:10+00:00,bgarlinghouse,"@XRPcryptowolf Im pretty sure I said (and hope I more accurately said!) it's more than 100,000 times more energy efficient..."
187,2021-04-01 03:15:19+00:00,bgarlinghouse,"It’s great to see more and more individual players taking action to address climate change/use renewables for mining, but we need consensus (no pun intended) across the entire industry to make all cryptos 100% renewable. 2/2"
188,2021-04-01 03:15:19+00:00,bgarlinghouse,"BTC is an exceptional store of value. 

It’s just not ideal as a payments mechanism bc of PoW energy costs / CO2 emitted (estimates show a weighted average carbon intensity of 480-500 gCO2eq per kWh) 1/2 https://t.co/efFS2ut7QI"
189,2021-03-30 03:59:39+00:00,bgarlinghouse,Thrilled to finally announce this one -- combining Tranglo’s APAC footprint with RippleNet will create an even better experience for customers who can take advantage of both ODL and Line of Credit!
190,2021-03-09 20:50:38+00:00,bgarlinghouse,"While specific settlement terms are confidential here, it’s clear to all that without accountability and action, trust erodes in this industry, at a crucial time when govts around the world are looking closely at crypto. 3/3"
191,2021-03-09 20:50:38+00:00,bgarlinghouse,"Social platforms are starting to acknowledge their role in allowing crypto scams to persist and recognize the need to be part of the solution. Some like @xrpforensics are helping detect/track stolen funds, but platforms need to lead the charge or it’s still just whack-a-mole. 2/3"
192,2021-03-09 20:50:38+00:00,bgarlinghouse,"Last year, @Ripple and I sued @YouTube for failing to enforce its own policies by allowing fake accounts (impersonating my/Ripple’s verified accounts) to conduct XRP giveaway scams. We’ve now come to a resolution to work together to prevent, detect and take down these scams. 1/3"
193,2021-03-08 21:17:22+00:00,bgarlinghouse,"Today, we’re announcing that Ripple and MGI have together decided to wind down our current partnership agreement, and are both committed to revisiting it in the future. See our full statement: 1/2 https://t.co/KGOzPWuThR"
194,2021-03-08 19:47:45+00:00,bgarlinghouse,@StraightUpXRP @VitalikButerin Ripple (and more recently the SEC!) has made me balder and much grayer… but still recognizable! (photo is at Ripple Swell Toronto in 2017)
195,2021-03-08 18:54:24+00:00,bgarlinghouse,".@danprimack - as you aptly said, “The crypto industry is now large enough and old enough that it deserves a US regulatory framework, whether benefitting Ripple or not.” The outcome of this lawsuit will define how the US treats future crypto innovation (not just Ripple and XRP)."
196,2021-03-06 03:18:02+00:00,bgarlinghouse,"...and now the SEC affirms that no determination has been made about XRP and it didn’t order or ask anyone to halt trading / delist, so retail holders shouldn’t blame the SEC but instead - wait for it - blame the exchanges! So who are they protecting?! 2/2"
197,2021-03-06 03:18:02+00:00,bgarlinghouse,"This is why regulation by enforcement wreaks such havoc. By bringing a massive enforcement case, the SEC acknowledges they didn’t “determine” anything, but the crypto markets - under pressure - interpreted the filing as such, causing massive damage to retail holders. 1/2"
198,2021-03-03 21:17:44+00:00,bgarlinghouse,"Today, a letter was filed on my behalf indicating my intent to file a Motion to Dismiss in response to the SEC’s amended complaint against me. Simply put, the SEC’s allegations are regulatory overreach. The letter speaks for itself: https://t.co/bwj9YdDOQw"
199,2021-02-25 16:30:24+00:00,bgarlinghouse,"A big step for Coinbase, and a giant leap for the industry. Congrats! https://t.co/1bbZNV6GiZ"
200,2021-02-25 00:50:28+00:00,bgarlinghouse,"Biden Administration’s priorities are clear - they talk about climate change everyday. Instead of arguing about exactly how much energy mining uses, let’s focus on making this industry the leader in sustainability. Props to @energywebx and others who are building solutions."
201,2021-02-22 17:26:06+00:00,bgarlinghouse,Thanks @CaitlinLong_! Wyoming is a leader in establishing a comprehensive regulatory framework for crypto (regardless of what asset you’re working with!). Proud to have a Ripple entity in WY &amp; other jurisdictions prioritizing reg clarity @SenLummis @Tyler_Lindholm
202,2021-02-19 23:31:13+00:00,bgarlinghouse,"Amazing! With the total market cap of crypto only $1b &lt;10 years ago, it seemed inevitable to me that we would see this day - but it's remarkable that it didn't even take a decade to get here. I'm even more optimistic for the next 10."
203,2021-02-16 23:51:21+00:00,bgarlinghouse,Can't help it -- dashes are so much better!
204,2021-01-29 17:54:14+00:00,bgarlinghouse,"Our defense begins today. Innovation is on trial, and we stand shoulder to shoulder w/ our partners &amp; the community to defend it. Together, w/ appropriate reg oversight, we can modernize outdated laws that clearly aren’t working to protect consumers and ensure orderly markets."
205,2021-01-25 20:26:46+00:00,bgarlinghouse,"We added 100+ new faces to the Ripple team, including several leadership members. We have an incredible, resilient team in place to tackle 2021 and beyond. No matter what, we’ll stay true to our mission of building an Internet of Value. 3/3"
206,2021-01-25 20:26:46+00:00,bgarlinghouse,"RippleX contributed to XRPL version upgrades, created a tool with Energy Web so ANYONE can help decarbonize the blockchain of their choice (crypto can be sustainable!), and is helping build new use cases for XRP with other industry participants. 2/3"
207,2021-01-25 20:26:46+00:00,bgarlinghouse,"2020 was a banner year for @Ripple, despite a disappointing ending related to U.S. regulation (understatement?). We processed millions of RippleNet txns, grew ODL 12x YoY and signed 15 new customers after the SEC complaint. 1/3 https://t.co/2efIQDojU7"
208,2021-01-20 23:30:13+00:00,bgarlinghouse,Day 1 priorities for @POTUS ✅
209,2021-01-18 19:23:59+00:00,bgarlinghouse,Congrats to Gary Gensler! We’re ready to work with SEC leadership and the broader Biden administration to chart a path forward for blockchain and crypto innovation in the US.
210,2021-01-13 20:31:06+00:00,bgarlinghouse,"If you ever had doubts that crypto was going to play an integral role in the future of our global financial systems...well, hope this clears some things up. Congrats @Anchorage!"
