,Date,User,Tweet
211,2021-01-11 17:48:12+00:00,bgarlinghouse,Ripple’s all-star engineering team continues to grow – thrilled to welcome Dev as our new SVP of Engineering!
212,2021-01-09 21:23:54+00:00,bgarlinghouse,"@DiepSanh Nope, that's not me. I don't have an account on Parler."
213,2021-01-07 20:14:12+00:00,bgarlinghouse,"And that’s what I have for you today! No one is being silent, nor will we give up this fight. We’re on the right side of the facts and of history, and look forward to our day in court - as well as engaging with the new SEC leadership once appointed. 10/10"
214,2021-01-07 20:14:12+00:00,bgarlinghouse,"We built a product that is the FIRST of its kind - integrating new infra comes with costs. ODL w/ XRP solves real problems with cost, speed, and settlement and that’s proven to the tune of billions of dollars. 9/10"
215,2021-01-07 20:14:12+00:00,bgarlinghouse,"Q: Did you pay customers to use XRP? 

We have provided some customers, especially first movers, w/ incentives to use ODL - this is building a payments network 101 (and totally lawful). Every payments network (PayPal, Visa, MC, etc) has or still uses incentives. 8/10"
216,2021-01-07 20:14:11+00:00,bgarlinghouse,"Q: Do investors have faith in Ripple? 

Yes, we have real shareholders. That is how you own Ripple equity - buying our stock, not buying XRP. We’re disappointed that Tetragon (who owns 1.5% of Ripple) is seeking to unfairly advantage itself through the SEC’s allegations. 7/10"
217,2021-01-07 20:14:11+00:00,bgarlinghouse,"Q: When are you responding to the SEC? Why are you silent? 

The legal process can be slow! Things may seem quiet, but there is plenty happening behind the scenes. We’ll be filing our initial response within weeks. Legal eagle @s_alderoty shares more 6/10 https://t.co/PIAsgohcG5"
218,2021-01-07 20:14:11+00:00,bgarlinghouse,"Delisting and halting are 2 separate things - most are  halting trading. With 8 different govt agencies, each with their own (and sometimes opposing) views of crypto, U.S. market participants are facing conflicting policies and no surprise, some act conservatively. 4/10"
219,2021-01-07 20:14:11+00:00,bgarlinghouse,"Q: Did you pay exchanges to list XRP? When will it be relisted? 

XRP is one of the most liquid (top 3-5) digital assets globally, and 95% is traded outside the US. Ripple has no control over where XRP is listed, who owns it, etc. It’s open-source and decentralized. 3/10"
220,2021-01-07 20:14:11+00:00,bgarlinghouse,"Q: Why didn’t Ripple settle with the SEC? 

Can’t get into specifics, but know we tried - and will continue to try w/ the new administration - to resolve this in a way so the XRP community can continue innovating, consumers are protected and orderly markets are preserved. 2/10"
221,2021-01-07 20:14:10+00:00,bgarlinghouse,"I’m not going to litigate the SEC’s unproven allegations on Twitter, and as you can imagine, there are new considerations to what can / should be said publicly after the litigation process starts. However, I would like to address 5 key questions I’ve seen. 1/10"
222,2020-12-24 18:32:49+00:00,bgarlinghouse,"A very important reminder!  

Thus far the world has heard the SEC's version of reality. The legal process will unfold from here and the world will have a much more robust and complete picture of the facts soon."
223,2020-12-23 20:38:08+00:00,bgarlinghouse,@Rwlshmakeup @Ripple it was not hacked by @ripple.  Please google to learn about the lawsuit that Ripple and I have filed against YouTube for being complicit in allowing these fraudsters to scam the crypto community.  I have also reported it to YouTube
224,2020-12-23 01:03:37+00:00,bgarlinghouse,Ripple has spent 8 years working tirelessly to build an incredible company transforming global payments. Our mission doesn’t stop! Here’s what I sent to employees yesterday + our lawyers’ reaction to today’s SEC filing. https://t.co/wGHW4hCW2T
225,2020-12-22 17:58:26+00:00,bgarlinghouse,"@bourbonni @nic__carter @zackvoell Ripple is one (albeit important) project within the XRP ecosystem.  The thing is that ""CEO at Ripple"" is NOT the same as the ""CEO of XRP"".  It's a critically important distinction."
226,2020-12-22 13:41:42+00:00,bgarlinghouse,"@APompliano @DaKauaiGuy I am not an enemy of Bitcoin.  Never have been.  I hold BTC and am bullish.  (As I said on your podcast.).  Oh, and good morning to you also!!"
227,2020-12-22 01:36:18+00:00,bgarlinghouse,"Jay Clayton is taking notes from the Grinch this holiday season, leaving the actual legal work to the next Administration…"
228,2020-12-22 01:27:12+00:00,bgarlinghouse,"The SEC - out of step with other G20 countries &amp; the rest of the US govt - should not be able to cherry-pick what innovation looks like (especially when their decision directly benefits China). Make no mistake, we are ready to fight and win - this battle is just beginning. (3/3)"
229,2020-12-22 01:27:12+00:00,bgarlinghouse,"We know crypto and blockchain technologies aren’t going anywhere. Ripple has and will continue to use XRP because it is the best digital asset for payments - speed, cost, scalability and energy efficiency. It’s traded on 200+ exchanges globally and will continue to thrive. (2/3)"
230,2020-12-17 20:27:04+00:00,bgarlinghouse,'The first but certainly not the last!' Big congrats to the Coinbase team on this milestone in their growth.
231,2020-12-16 23:28:12+00:00,bgarlinghouse,"Amazed that it’s already been a year and a half of our partnership @walexholmes. Ripple and MGI have settled billions of $ globally using XRP in production - it’s quite simply the most efficient digital asset for payments (speed, scalability &amp; low transaction cost)"
232,2020-12-15 19:17:24+00:00,bgarlinghouse,@ClemondNFlinch @Rtonkins74 @TplusZero @Ripple I intend to live up to our pledge (which had a one year time horizon)
233,2020-12-15 17:42:38+00:00,bgarlinghouse,"Thrilled to have Sandie join our Board - with her years of expertise in regulatory affairs, treasury and financial services, she’ll be invaluable in helping guide Ripple through our next phase of growth."
234,2020-12-09 00:32:48+00:00,bgarlinghouse,"Props to Square for acknowledging BTC’s current energy consumption, and investing in clean energy solutions. Let’s get to 100% renewables in the future! #climatechangeisnotahoax"
235,2020-12-08 23:34:33+00:00,bgarlinghouse,"Protecting consumers has to be part of that. I'm not against privacy, I'm against bad actors taking advantage of anonymous transactions. I've said many, many times before: KYC/AML matter for crypto to move from the fringes to an integral part of our global financial system. (3/3)"
236,2020-12-08 23:34:33+00:00,bgarlinghouse,"*Reasonable* oversight is necessary if we want crypto to be the infrastructure of the next gen financial system. With potential new US guidance for non-custodial crypto wallets, let’s not forget the end goal - to build a more inclusive &amp; efficient financial system for all. (2/3)"
237,2020-12-08 23:34:32+00:00,bgarlinghouse,"Our industry celebrates when institutions &amp; regulators publicly laud real use cases (ie: SEC, Treasury highlighting using crypto for payments) but balks at the idea that KYC/AML is a fundamental part of a robust financial system that protects consumers from scams/bad actors.(1/3)"
238,2020-12-02 23:47:24+00:00,bgarlinghouse,I mean @jchatterleyCNN -  rewatching the clip and 3 drinks in already...
239,2020-12-02 22:42:16+00:00,bgarlinghouse,Someone is going to create a drinking game for every time I say “clarity” and “certainty” from now on 😂. Thanks @jchatterlyCNN for having me on this morning! Looking forward to 2021 as more companies hold crypto on their balance sheets (asset diversification is key here!)
240,2020-11-30 18:45:37+00:00,bgarlinghouse,@XrpBart I have not seen this one.  can you DM me the URL it points to?  we'll work to get it taken down
241,2020-11-30 18:22:10+00:00,bgarlinghouse,"Great chatting with @dannyfortson! We cover a lot of ground on his podcast - rampant XRP scams on YouTube, rebuilding global payments from the ground up and even managed to squeeze in a quick shoutout to KU. #RockChalkJayhawk

https://t.co/9W0mmEweMp"
242,2020-11-28 19:11:19+00:00,bgarlinghouse,"Good morning to everyone besides scammers defrauding people with fake XRP giveaways. Hackers are using IDN homograph attacks (e.g. capital I instead of lowercase l in ripple. com, etc) and these websites can stay up for months (despite reporting them) https://t.co/VdAp8BJc3W"
243,2020-11-28 00:12:56+00:00,bgarlinghouse,"@tyencho it's so frustrating.  Yes, this is fake...."
244,2020-11-28 00:02:11+00:00,bgarlinghouse,"Always great catching up with @APompliano! Even if we don’t agree on everything, I appreciate and welcome the healthy discourse. Thanks for having me on the show."
245,2020-11-23 01:32:37+00:00,bgarlinghouse,"@GAL_SAL_ @Google i was not aware - if you have any information on this, please DM me."
246,2020-11-22 23:05:45+00:00,bgarlinghouse,"For example, hackers took over @AndreoBee's @YouTube channel to impersonate me, and over 24 hours later + multiple complaints, the channel is still up?! The longer these fakes stay up, the more people that are scammed (2/2) https://t.co/ONgWJq6fjz"
247,2020-11-22 23:05:45+00:00,bgarlinghouse,"As always, with crypto rallies, come the scam artists with new fake “giveaways” on social media platforms. Why is it taking the platforms so long to take action? (1/2)"
248,2020-11-20 20:02:18+00:00,bgarlinghouse,"As a BTC holder, I want it to succeed &amp; believe in its use case (store of value), same as I believe in XRP’s distinct use case (payments). This also means being aware of potential weaknesses (like mining control in China) for future progress. These two are NOT mutually exclusive."
249,2020-11-19 22:59:07+00:00,bgarlinghouse,"Never a dull moment in crypto! Institutional investor interest is skyrocketing... industry growth comes down to real world utility. As a store of value, BTC is an extremely useful inflation hedge. XRP’s speed, cost and scalability make it extremely useful for payments. (1/2)"
250,2020-11-13 21:25:24+00:00,bgarlinghouse,"Thanks @fintechfrank for having me on, and not holding back the tough questions. As discussed, once banks have regulatory clarity, there’s little doubt in my mind that they’ll use these technologies (obv jumped the gun when I predicted 2019 was the year banks would use ODL!)"
251,2020-11-09 16:46:08+00:00,bgarlinghouse,"#6 - Biden to require public companies to disclose climate change-related activities and GHG emissions in their operations. 

Love to see the action on climate change - first NYDFS, now this. Public companies holding BTC (ahem Square) -- may want to pay attention 👀"
252,2020-11-07 19:52:00+00:00,bgarlinghouse,"Democracy wins - regardless of who you voted for, it’s incredible to see the historic voter turnout this election. Congrats to President-elect @JoeBiden and Vice President-elect @KamalaHarris -  it's time to come together and turn to the many challenges that lie ahead"
253,2020-10-30 20:10:57+00:00,bgarlinghouse,Congrats on a very strong quarter! Proud to be a partner in MGI's digital growth transformation. There’s no doubting the network’s growth and benefits for consumers.
254,2020-10-30 15:25:39+00:00,bgarlinghouse,"HUGE, pivotal step from @NYDFS. Let’s all be part of the solution for the global climate crisis NOT exacerbate the problem. As more companies (Square, RH, MicroStrategy, PayPal) hold/provide services for BTC, critical to mitigate carbon impact AND use more energy efficient assets"
255,2020-10-27 19:21:45+00:00,bgarlinghouse,"2/  Some have suggested Ripple is “fleeing” the US, let me unequivocally say this is absolutely not the case. We’re a proud US-based company, and would like to stay here but a lack of regulatory clarity and level playing field is forcing us to evaluate other jurisdictions. (2/2)"
256,2020-10-22 17:18:54+00:00,bgarlinghouse,"The US is out of sync with other G20 markets - it’s critical for @Ripple to have a level playing field in order to compete on a global stage. The UK, Singapore, Japan, Switzerland and UAE are at the top of our list because they’re providing clarity and consistency."
257,2020-10-14 21:14:36+00:00,bgarlinghouse,@Revelation22_5 @MariaBartiromo There was an interruption in the audio (the control room wanted me to know it was wrapping momentarily) and I thought it was a problem with my wifi / internet connection.
258,2020-10-14 18:24:24+00:00,bgarlinghouse,"Thanks @MariaBartiromo for having me on this AM! US interests, companies &amp; innovation are all at stake in this race for control of our future global financial infra. China, UK, and others are far ahead -- US is out of sync and needs to implement a clear reg framework now."
259,2020-10-14 16:09:24+00:00,bgarlinghouse,@rodriguez554 always be suspicious!  Those are NOT my accounts... they are people impersonating me
260,2020-10-14 16:02:59+00:00,bgarlinghouse,"Our 4th annual #RippleSwell 2020 has officially commenced. From Toronto to San Francisco, Singapore to virtual -- we have a fantastic lineup of speakers, panels, demos and some fun surprises over the next two days. Swell-o and welcome! 👋 https://t.co/WKEFiiP7bR"
261,2020-10-13 16:45:49+00:00,bgarlinghouse,"I get to interview @arrington (instead of the other way around!) at #UBRIConnect today. We’ll be discussing the rise of DeFi, state of reg and the future of crypto. Tune in live at 4:40pm PT https://t.co/yV87pvhkgh"
262,2020-10-12 11:37:50+00:00,bgarlinghouse,"The lack of a single national regulatory framework is putting US innovation and US companies at a significant disadvantage. All we’re asking for is a level playing field - if we need to move to another country to get that, then that’s the path we will have to take. (5/5)"
263,2020-10-12 11:37:50+00:00,bgarlinghouse,"To make matters worse, some US regulators have already made decisions that actively favor Chinese technologies OVER US companies. Legislation like the #DCEA can bring US companies to equal footing. https://t.co/7PRjN7qs9j (4/5)"
264,2020-10-12 11:37:49+00:00,bgarlinghouse,"However, last week’s DOJ report lists 8 separate US reg bodies each with a different view: crypto is property, crypto is a commodity, crypto is a virtual currency, crypto is a security, etc. Regulation shouldn’t be a guessing game. https://t.co/B18ZIVodZC (3/5)"
265,2020-10-12 11:37:49+00:00,bgarlinghouse,Ripple is a proud US-based company. Ripple abides by and supports critical laws - like strong BSA/AML controls - that keep bad actors out and consumers safe. We are NOT looking to evade US regulation. (2/5)
266,2020-10-12 11:37:49+00:00,bgarlinghouse,Lots of speculation last week as Team @Ripple considers some very important decisions about our future. I want to clarify a couple of things related to some of what I read. (1/5)
267,2020-10-09 15:58:55+00:00,bgarlinghouse,@hunterwalk we are actually do a company holiday on the 4th.
268,2020-10-08 19:00:24+00:00,bgarlinghouse,"We need a framework (like #DCEA) that provides clarity, protects consumers AND fosters innovation in the United States or companies will move their investment (or whole company) overseas. (2/2)"
269,2020-10-08 19:00:23+00:00,bgarlinghouse,"An 70+ page contradictory report is not regulatory clarity -- many responsible private players are trying to follow the rules, but that becomes increasingly hard when there’s no single arbiter of the law (5+ govt agencies with different PoVs on crypto). (1/2)"
270,2020-10-06 20:39:44+00:00,bgarlinghouse,"Strongest internet companies built in the US, in part b/c of regulatory clarity. We have that opp with blockchain + digital assets. Responsible players like Ripple aren’t looking to avoid rules, we just want to operate in a jurisdiction where the rules are clear. #DCEA of 2020"
271,2020-10-05 19:15:18+00:00,bgarlinghouse,"Today, I’m excited to announce longtime Ripplers @ashgoblue and @monicalongsf as GM of RippleNet and GM of RippleX (previously Xpring), respectively. Ripple is evolving, but our core mission remains - we’re builders, not disruptors. https://t.co/EWl1FQpbrX"
272,2020-09-30 16:15:05+00:00,bgarlinghouse,"It’s clear crypto belongs in future global financial systems - but that future depends on us taking action now to ensure this tech can be used sustainably. Today, @Ripple is committing to be carbon neutral by 2030 AND building tools so any blockchain can use renewable energy."
273,2020-09-16 01:04:39+00:00,bgarlinghouse,"Disappointing to see India flip flop on crypto, hamstringing a nascent industry which could serve one of the biggest populations of unbanked/underbanked citizens."
274,2020-09-09 13:52:19+00:00,bgarlinghouse,"We've all seen the stats - companies with diverse leaders and board members are stronger, more strategic and equitable for their workforces. Today’s pledge for @boardchallenge_ is one step of many @Ripple and I are committed to pursuing to prioritize D&amp;I."
275,2020-08-28 20:43:24+00:00,bgarlinghouse,"It’s up to each and every one of us to continue calling out systemic racism. MLK spoke 57 years ago about a more just and equal world for all, and we will not give up the fight. #BlackLivesMatter"
276,2020-08-28 15:19:08+00:00,bgarlinghouse,The pandemic is throwing so many playbooks out the window... yesterday's action flies in the face of decades of precedent. Signs point to further dollar debasement in the near term (leading to further diversification of assets which will certainly be good for crypto).
277,2020-08-20 21:41:09+00:00,bgarlinghouse,"Thank you @TomEmmer and @DigitalChamber’s PAC for hosting today’s Crypto Town Hall (hopefully the first of many). Conversations like this with elected officials and industry participants are a key step to achieving regulatory clarity, where all boats can rise!"
278,2020-08-19 23:58:39+00:00,bgarlinghouse,Join me tomorrow at the inaugural Crypto Town Hall with @tomemmer! The U.S. has a real opportunity to embrace crypto innovation as the future of payments (despite 2020 throwing an ongoing series of cataclysmic events our way 😂). Register here: https://t.co/QtpV2881H5
279,2020-08-14 13:12:24+00:00,bgarlinghouse,An important correction as there was a significant typo below. If I ever misspeak - I want to be the first one to address it. We have processed 2M+ (not 2B+) txns on RippleNet w/ a notional value of $7B+
280,2020-08-13 23:03:55+00:00,bgarlinghouse,"4/ P.S. @nathanielpopper, for future reference - quick fact check and in keeping with NYT standards - my Twitter handle is @bgarlinghouse, not @bradgarlinghouse (4/4)"
281,2020-08-13 23:03:55+00:00,bgarlinghouse,"3/ Over two dozen customers are on board w/ ODL including MoneyGram, goLance, Viamericas, FlashFX, Azimo and the list goes on.... (3/4)"
282,2020-08-13 23:03:55+00:00,bgarlinghouse,"2/ I'll let the data speak for itself:
- ODL (product that uses XRP) has accounted for more than $2 billion in txns since its launch
- ODL volume grew 11x YoY comparing H1’19 v. H1’20 
- In less than 3yrs, we’ve processed 2B+ txns on RippleNet w a notional value of $7B+ (2/4)"
283,2020-08-13 23:03:55+00:00,bgarlinghouse,"1/ My fav skeptics are active today! (@FT @nathanielpopper) Ripple has absolutely no plans to ‘reset’ our strategy. Using XRP to solve a real-world, $10T problem, like cross-border payments, is working (1/4) https://t.co/Gkf70dq7G6"
284,2020-08-11 17:52:30+00:00,bgarlinghouse,"As I was saying… crypto shines like gold. @microstrategy's move to diversify in favor of digital assets is bold - and brilliant! One of the first companies to do so, but they certainly won't be the last. https://t.co/2RFS4FZEQH"
285,2020-08-03 23:17:25+00:00,bgarlinghouse,"As @fundstrat said, it comes down to trust in the financial system at the end of the day. As global populations continue to lose confidence in fiat currencies (as we’re seeing with USD), they will choose to diversify. Our future global financial system will do the same (3/3)"
286,2020-08-03 23:17:25+00:00,bgarlinghouse,"A year ago, many decried crypto as a scam, and now a majority of govts are looking seriously at blockchain. It addresses frictions (i.e. settlement, transparency, etc) that were assumed VERY hard to solve before. Crypto is up 80% while USD is down 3% YTD (2/3)"
287,2020-08-03 23:17:25+00:00,bgarlinghouse,"Thread on this USD as the world’s reserve currency has been the backbone of global financial infra, and that position isn’t going to disappear in favor of gold/the yuan/crypto/any other asset any time soon. But is it weaker today? Yes. (1/3)"
288,2020-07-30 19:14:16+00:00,bgarlinghouse,"Another day, another platform hosting scams... @LinkedIn is the latest, with imposter profiles created by bad actors. PSA: stay vigilant and skeptical of suspicious requests/messages. If it looks like a scam, it probably is! https://t.co/2cSQaZJFtE"
289,2020-07-23 16:46:18+00:00,bgarlinghouse,Welcome to the resistance @SteveWoz 😂
290,2020-07-23 04:37:52+00:00,bgarlinghouse,"2020 Brad to 2018 Brad...
https://t.co/qa9Rr0Z5Av https://t.co/GYMmHBelyo"
291,2020-07-22 23:46:38+00:00,bgarlinghouse,"BOOM!  Today’s ruling is a huge step forward. The @USOCC is absolutely leading the way to foster innovation, protect consumers and provide a level playing field for all. The future has never been fiat versus crypto - these can and should coexist in harmony!"
292,2020-07-18 01:59:30+00:00,bgarlinghouse,"Malicious scams on @Twitter, @YouTube and others have persisted for years without these platforms taking any real action or accountability to address the issue with more than a band-aid. (3/4)"
293,2020-07-18 01:59:29+00:00,bgarlinghouse,"Seems there is finally consensus across the board that this hack is NOT a crypto problem, this is a social media platform problem. (2/4)"
294,2020-07-18 01:59:29+00:00,bgarlinghouse,"👋🏼 It took a couple days, but glad to report I’m able to access my twitter account again. A few thoughts on the Twitter happenings this week...(1/4)"
295,2020-07-15 20:32:41+00:00,bgarlinghouse,It appears other tech companies have also been hacked so be alert.
296,2020-07-15 20:32:41+00:00,bgarlinghouse,@ripple Twitter account has been hacked.  Please disregard the most recent message (pinned) - and ALWAYS disregard any XRP giveaways purporting to be from Ripple or me.
297,2020-07-10 00:56:25+00:00,bgarlinghouse,"While everyone else considers crawling, China is walking..."
298,2020-07-08 12:37:14+00:00,bgarlinghouse,"It’s unacceptable that those who have the least, often pay the most. Remittances have long been underserved by traditional finance, even as they make up a huge part of the global economy. You want to help the unbanked? Start there."
299,2020-06-26 22:25:14+00:00,bgarlinghouse,"Greer sums it up perfectly: “The private sector is doing its part; it is incumbent on U.S. policymakers to do theirs.” There’s an entire industry ready to expand American innovation, we just need to know the rules."
300,2020-06-19 15:46:08+00:00,bgarlinghouse,"Recognizing and celebrating #Juneteenth today. It’s striking how many of us weren’t taught about this historic day growing up. Today, @Ripple is making Juneteenth a company holiday to acknowledge and take action to root out systemic racism. This is long overdue."
301,2020-06-16 23:38:01+00:00,bgarlinghouse,"Proud of team @Ripple, always"
302,2020-06-13 00:55:19+00:00,bgarlinghouse,"Brrr jokes aside (which are hilarious), we need to take a cold hard look at how many countries are likely on the precipice of extreme inflation. Diversification into other asset classes including crypto could help stabilize markets in the future."
303,2020-06-01 14:14:00+00:00,bgarlinghouse,"We cannot stop shining a light on the deep-seated racism that the murders of Ahmaud Arbery, Breonna Taylor, George Floyd, and countless others represent.  

""If you are neutral in situations of injustice, you have chosen the side of the oppressor."" -Desmond Tutu"
304,2020-06-01 14:13:59+00:00,bgarlinghouse,We need to be proactively anti-racist – presently and in the future – and completely change the way that we see and support our communities of color. This is about life and death.
305,2020-06-01 14:13:59+00:00,bgarlinghouse,"While I can’t ever fully understand the pain of our Black community that recent and past events have caused, I stand in solidarity with all who are fighting to save Black lives."
306,2020-05-29 18:03:41+00:00,bgarlinghouse,"I’ve had the pleasure of working with @MonicaLongSF for the past 5 years, and she is incredible. Congratulations on this honor!"
307,2020-05-26 19:16:36+00:00,bgarlinghouse,"Smart ideas, and easily implemented. Why not also show when an account was created/when the photo was last updated on @instagram (or any social media platform)? Frankly, the lack of action so far speaks to how little energy big tech is expending to solve this problem."
308,2020-05-26 16:05:38+00:00,bgarlinghouse,"This piece nails it. One caveat - public digital assets like XRP are not exempt from U.S. (or global) financial oversight -- actually the opposite. Responsible players who use these assets want to work with regulators, not against them. (2/2)"
309,2020-05-26 16:05:38+00:00,bgarlinghouse,"U.S. regulators: now is the time to step up and lean into digital currencies. Remaining complacent is actually setting us back, while China’s grip on both crypto and fiat payments becomes stronger. https://t.co/NuGmFZmf7x (1/2)"
310,2020-05-05 20:03:31+00:00,bgarlinghouse,"I could listen to @JoelKatz talk about anything (seriously), and now you can too! #BlockStars launches today."
311,2020-04-29 18:15:47+00:00,bgarlinghouse,"Well, @YouTube, this is awkward… https://t.co/tTMwaDlUqB"
